{
  "$schema": "cwa-dashboard/events-index/v1",
  "generated_at": "2026-10-15T17:21:00.500Z",
  "window": {
    "from": "2026-10-15T05:00:00.000Z",
    "to": "2026-10-15T17:21:00.500Z"
  },
  "events": [
    {
      "event_id": "01M5099QJMHFG77A4K4QR3MSK2",
      "recorded_at": "2026-10-15T17:21:00.500Z",
      "service": "investor-relations",
      "language": "typescript",
      "redaction_mode": "full",
      "route": "long-context-qa",
      "route_policy_version": "illustrative/v1",
      "profile": {
        "id": "long-context-reinforced",
        "version": 1
      },
      "route_policy_sha256": "4b25b81d923d6e9ddab1a52c4451ce0a4f33dc2bba356c1a00b3bd066a3f48ee",
      "profile_sha256": "b2669043c466ec49ee717936ad0fa820555cf5e506e3e0e1f19611e6395487cf",
      "budget_input": 500,
      "compressed_count": 6,
      "outcome": "assembled",
      "reason_codes": [
        "superseded"
      ],
      "input_tokens": 493,
      "session": {
        "id": "ir-3",
        "turn_index": 2
      },
      "total_ms": 0.9475419999999986
    },
    {
      "event_id": "01M5090JKMASM5529ABCF79QQZ",
      "recorded_at": "2026-10-15T17:16:00.500Z",
      "service": "investor-relations",
      "language": "typescript",
      "redaction_mode": "full",
      "route": "long-context-qa",
      "route_policy_version": "illustrative/v1",
      "profile": {
        "id": "long-context-reinforced",
        "version": 1
      },
      "route_policy_sha256": "4b25b81d923d6e9ddab1a52c4451ce0a4f33dc2bba356c1a00b3bd066a3f48ee",
      "profile_sha256": "b2669043c466ec49ee717936ad0fa820555cf5e506e3e0e1f19611e6395487cf",
      "budget_input": 500,
      "compressed_count": 2,
      "outcome": "assembled",
      "reason_codes": [
        "superseded"
      ],
      "input_tokens": 471,
      "session": {
        "id": "ir-3",
        "turn_index": 1
      },
      "total_ms": 0.32216600000000994
    },
    {
      "event_id": "01M508QDMMT8Y1VM51Y0MQNXM2",
      "recorded_at": "2026-10-15T17:11:00.500Z",
      "service": "investor-relations",
      "language": "typescript",
      "redaction_mode": "full",
      "route": "long-context-qa",
      "route_policy_version": "illustrative/v1",
      "profile": {
        "id": "long-context-reinforced",
        "version": 1
      },
      "route_policy_sha256": "4b25b81d923d6e9ddab1a52c4451ce0a4f33dc2bba356c1a00b3bd066a3f48ee",
      "profile_sha256": "b2669043c466ec49ee717936ad0fa820555cf5e506e3e0e1f19611e6395487cf",
      "budget_input": 500,
      "compressed_count": 0,
      "outcome": "assembled",
      "reason_codes": [],
      "input_tokens": 331,
      "session": {
        "id": "ir-3",
        "turn_index": 0
      },
      "total_ms": 0.16100000000000136
    },
    {
      "event_id": "01M504NDFMDGR1Q6EC4BTKCC5C",
      "recorded_at": "2026-10-15T16:00:00.500Z",
      "service": "contract-reviewer",
      "language": "typescript",
      "redaction_mode": "full",
      "route": "contract-review",
      "route_policy_version": "review/v2",
      "profile": {
        "id": "contract-review",
        "version": 1
      },
      "route_policy_sha256": "ea079c1beb76e9b4ae1b24013cd0de9654edc34aab8dd720eb04bc37a13d055d",
      "profile_sha256": "378fc2b5aeddb183cd210b55730d703681e22342089186d7b9b15a58218fe90d",
      "budget_input": 130,
      "compressed_count": 0,
      "outcome": "refused",
      "refused_reason": "slot_floor_over_budget",
      "reason_codes": [],
      "total_ms": 0.2272920000000056
    },
    {
      "event_id": "01M5017HVM0ZA194R0PG8TD0HT",
      "recorded_at": "2026-10-15T15:00:00.500Z",
      "service": "invoice-extractor",
      "language": "typescript",
      "redaction_mode": "full",
      "route": "extract",
      "route_policy_version": "illustrative/v1",
      "profile": {
        "id": "extraction",
        "version": 1
      },
      "route_policy_sha256": "86ae19a39b56321205dbbbb3d67cae9caa347e0ff0da69d018123420026b8e8c",
      "profile_sha256": "3ca3642d6f9b7f98ebd8855521c441ac334fd7bf60af1fdabe68a1e0edd9e41e",
      "budget_input": 2048,
      "compressed_count": 0,
      "outcome": "refused",
      "refused_reason": "protected_content_over_budget",
      "reason_codes": [],
      "total_ms": 0.19416700000002152
    },
    {
      "event_id": "01M4ZYYA3MV0M2RZBF1H40Y7MV",
      "recorded_at": "2026-10-15T14:20:00.500Z",
      "service": "policy-desk",
      "language": "typescript",
      "redaction_mode": "full",
      "route": "policy-desk",
      "route_policy_version": "desk/v1",
      "profile": {
        "id": "policy-desk",
        "version": 1
      },
      "route_policy_sha256": "e1ca39fb0ef5364ebfc90c4f14736490f39f4c364e43665cd8495e79b8cdbcf4",
      "profile_sha256": "cdaf0fa27b36579321cf5a1110acf52c61efc835c225a29070bd36d786045d59",
      "budget_input": 4096,
      "compressed_count": 0,
      "outcome": "assembled",
      "reason_codes": [],
      "input_tokens": 65,
      "session": {
        "id": "desk-agent-12",
        "turn_index": 1
      },
      "total_ms": 0.07983300000000781
    },
    {
      "event_id": "01M4ZXSP7MKY2A3A6DG03DFCHK",
      "recorded_at": "2026-10-15T14:00:00.500Z",
      "service": "policy-desk",
      "language": "typescript",
      "redaction_mode": "full",
      "route": "policy-desk",
      "route_policy_version": "desk/v1",
      "profile": {
        "id": "policy-desk",
        "version": 1
      },
      "route_policy_sha256": "e1ca39fb0ef5364ebfc90c4f14736490f39f4c364e43665cd8495e79b8cdbcf4",
      "profile_sha256": "cdaf0fa27b36579321cf5a1110acf52c61efc835c225a29070bd36d786045d59",
      "budget_input": 4096,
      "compressed_count": 0,
      "outcome": "refused",
      "refused_reason": "conflict_unresolved",
      "reason_codes": [],
      "session": {
        "id": "desk-agent-12",
        "turn_index": 0
      },
      "total_ms": 0.12820899999999824
    },
    {
      "event_id": "01M4ZTBTKMYHK0PXNZT3T5KPGM",
      "recorded_at": "2026-10-15T13:00:00.500Z",
      "service": "support-assistant",
      "language": "typescript",
      "redaction_mode": "full",
      "route": "support-chat",
      "route_policy_version": "illustrative/v1",
      "profile": {
        "id": "policy-first-chat",
        "version": 1
      },
      "route_policy_sha256": "474d6e1fb8563eb94e39663976c19682317e30e8cf952955b5505b8c17a91191",
      "profile_sha256": "f4cafe316b5c6b03e286113a0eac332f546ee46da4e2c9fc2217ce723165b03f",
      "budget_input": 8192,
      "compressed_count": 0,
      "outcome": "assembled",
      "reason_codes": [
        "stale_state",
        "below_threshold",
        "duplicate_content",
        "source_diversity_cap"
      ],
      "input_tokens": 75,
      "total_ms": 0.24979200000001356
    },
    {
      "event_id": "01M4ZTBTKMJGSXAR1DY556CNS2",
      "recorded_at": "2026-10-15T13:00:00.500Z",
      "service": "support-assistant-canary",
      "language": "typescript",
      "redaction_mode": "full",
      "route": "support-chat",
      "route_policy_version": "illustrative/v1",
      "profile": {
        "id": "cache-first-chat",
        "version": 1
      },
      "route_policy_sha256": "bb3a4a4dcdb29c229a0a9da5ef31ae0f00513e0a93513da3ec3566cedc1aaa31",
      "profile_sha256": "5b86d884b783533f3b9b75080be79cbed63a5e5efb35afe864fd34ffdf7c1fcf",
      "budget_input": 4096,
      "compressed_count": 0,
      "outcome": "assembled",
      "reason_codes": [
        "below_threshold"
      ],
      "input_tokens": 40,
      "total_ms": 0.14295799999999304
    },
    {
      "event_id": "01M4ZPXYZMMH9JA1A795GT6HGX",
      "recorded_at": "2026-10-15T12:00:00.500Z",
      "service": "support-assistant",
      "language": "typescript",
      "redaction_mode": "full",
      "route": "support-chat",
      "route_policy_version": "conflict-fact/v1",
      "profile": {
        "id": "billing-facts",
        "version": 1
      },
      "route_policy_sha256": "093535f85301ea6f3a5b07be7fb6f9ebd37e58a060faf042c63475ea7b5f4e31",
      "profile_sha256": "1cdb2ff43f54303250a92c2e53e29d15a81b6c3e95343e60abea174663c2fcf2",
      "budget_input": 4096,
      "compressed_count": 0,
      "outcome": "assembled",
      "reason_codes": [
        "conflict_lost"
      ],
      "input_tokens": 51,
      "total_ms": 0.1736670000000231
    },
    {
      "event_id": "01M4ZKRB14SW2GC3BS775AZDHG",
      "recorded_at": "2026-10-15T11:04:30.500Z",
      "service": "review-agent",
      "language": "typescript",
      "redaction_mode": "digest_only",
      "route": "agent-loop",
      "route_policy_version": "illustrative/v1",
      "profile": {
        "id": "tool-agent",
        "version": 1
      },
      "route_policy_sha256": "f9fd153ee1e346c879f3bd96fa989159d5c09cde20c9d83e2cf607d2ac29451f",
      "profile_sha256": "dfbe92103bdbc21fe5635a09468700635e43ee00ed3a0e280491130f8157721e",
      "budget_input": 6000,
      "compressed_count": 0,
      "outcome": "assembled",
      "reason_codes": [
        "producer_slot_not_allowed",
        "capability_not_allowed",
        "superseded"
      ],
      "input_tokens": 265,
      "session": {
        "id": "agent-run-412",
        "turn_index": 1
      },
      "total_ms": 0.21762499999999818
    },
    {
      "event_id": "01M4ZKH0N4HT508FAY0X5JVM7S",
      "recorded_at": "2026-10-15T11:00:30.500Z",
      "service": "review-agent",
      "language": "typescript",
      "redaction_mode": "digest_only",
      "route": "agent-loop",
      "route_policy_version": "illustrative/v1",
      "profile": {
        "id": "tool-agent",
        "version": 1
      },
      "route_policy_sha256": "f9fd153ee1e346c879f3bd96fa989159d5c09cde20c9d83e2cf607d2ac29451f",
      "profile_sha256": "dfbe92103bdbc21fe5635a09468700635e43ee00ed3a0e280491130f8157721e",
      "budget_input": 6000,
      "compressed_count": 0,
      "outcome": "assembled",
      "reason_codes": [
        "producer_slot_not_allowed",
        "capability_not_allowed"
      ],
      "input_tokens": 251,
      "session": {